{
  "schemaVersion": "1.0.0",
  "catalogVersion": "panama-training-2026-10-31",
  "source": "catalogo-panama",
  "retrievedAt": "2026-10-31T06:00:00.000Z",
  "opportunities": [
    {
      "opportunityId": "TR-001",
      "title": "Fundamentos de soporte técnico",
      "provider": "INFOTEC",
      "type": "course",
      "url": "https://example.org/training/tr-001",
      "language": "es",
      "specializations": ["it_support"],
      "coveredSkills": [{ "skillId": "PA-IT-0001", "level": 2 }],
      "prerequisites": [],
      "costUsd": 0,
      "durationHours": 40,
      "modality": "online",
      "location": null,
      "schedule": { "days": [1, 3], "startMinute": 1080, "endMinute": 1260, "weeklyHours": 6 },
      "seatsAvailable": 40,
      "credentialRelevance": 0.2,
      "source": "catalogo-panama",
      "retrievedAt": "2026-10-31T06:00:00.000Z"
    },
    {
      "opportunityId": "TR-002",
      "title": "Redes y conectividad básica",
      "provider": "Cisco Networking Academy",
      "type": "certification",
      "url": "https://example.org/training/tr-002",
      "language": "es",
      "specializations": ["it_support"],
      "coveredSkills": [{ "skillId": "PA-IT-0003", "level": 2 }],
      "prerequisites": [],
      "costUsd": 120,
      "durationHours": 70,
      "modality": "online",
      "location": null,
      "schedule": null,
      "seatsAvailable": 25,
      "credentialRelevance": 0.9,
      "source": "catalogo-panama",
      "retrievedAt": "2026-10-31T06:00:00.000Z"
    },
    {
      "opportunityId": "TR-003",
      "title": "Mantenimiento de equipos de cómputo",
      "provider": "INFOTEC",
      "type": "course",
      "url": "https://example.org/training/tr-003",
      "language": "es",
      "specializations": ["it_support"],
      "coveredSkills": [{ "skillId": "PA-IT-0002", "level": 2 }],
      "prerequisites": ["PA-IT-0001"],
      "costUsd": 80,
      "durationHours": 60,
      "modality": "hybrid",
      "location": { "lat": 8.983, "lng": -79.52 },
      "schedule": { "days": [6], "startMinute": 480, "endMinute": 720, "weeklyHours": 4 },
      "seatsAvailable": 20,
      "credentialRelevance": 0.5,
      "source": "catalogo-panama",
      "retrievedAt": "2026-10-31T06:00:00.000Z"
    },
    {
      "opportunityId": "TR-004",
      "title": "Windows para soporte técnico",
      "provider": "Microsoft Learn",
      "type": "certification",
      "url": "https://example.org/training/tr-004",
      "language": "en",
      "specializations": ["it_support"],
      "coveredSkills": [{ "skillId": "PA-IT-0004", "level": 3 }],
      "prerequisites": [],
      "costUsd": 0,
      "durationHours": 35,
      "modality": "online",
      "location": null,
      "schedule": null,
      "seatsAvailable": 100,
      "credentialRelevance": 0.85,
      "source": "catalogo-panama",
      "retrievedAt": "2026-10-31T06:00:00.000Z"
    },
    {
      "opportunityId": "TR-005",
      "title": "Proyecto: mesa de ayuda simulada",
      "provider": "Puente Laboral",
      "type": "project",
      "url": "https://example.org/training/tr-005",
      "language": "es",
      "specializations": ["it_support"],
      "coveredSkills": [
        { "skillId": "PA-IT-0001", "level": 3 },
        { "skillId": "PA-SOFT-0004", "level": 2 }
      ],
      "prerequisites": ["PA-IT-0001"],
      "costUsd": 0,
      "durationHours": 30,
      "modality": "online",
      "location": null,
      "schedule": null,
      "seatsAvailable": 15,
      "credentialRelevance": 0.3,
      "source": "catalogo-panama",
      "retrievedAt": "2026-10-31T06:00:00.000Z"
    },
    {
      "opportunityId": "TR-006",
      "title": "Excel intermedio",
      "provider": "Edutin",
      "type": "course",
      "url": "https://example.org/training/tr-006",
      "language": "es",
      "specializations": ["administration"],
      "coveredSkills": [{ "skillId": "PA-OFF-0002", "level": 2 }],
      "prerequisites": [],
      "costUsd": 0,
      "durationHours": 20,
      "modality": "online",
      "location": null,
      "schedule": null,
      "seatsAvailable": 60,
      "credentialRelevance": 0.4,
      "source": "catalogo-panama",
      "retrievedAt": "2026-10-31T06:00:00.000Z"
    },
    {
      "opportunityId": "TR-007",
      "title": "Excel avanzado y tablas dinámicas",
      "provider": "Udemy",
      "type": "course",
      "url": "https://example.org/training/tr-007",
      "language": "es",
      "specializations": ["administration"],
      "coveredSkills": [{ "skillId": "PA-OFF-0002", "level": 3 }],
      "prerequisites": ["PA-OFF-0002"],
      "costUsd": 15,
      "durationHours": 25,
      "modality": "online",
      "location": null,
      "schedule": null,
      "seatsAvailable": 80,
      "credentialRelevance": 0.45,
      "source": "catalogo-panama",
      "retrievedAt": "2026-10-31T06:00:00.000Z"
    },
    {
      "opportunityId": "TR-008",
      "title": "Paquete de oficina completo",
      "provider": "INFOTEC",
      "type": "course",
      "url": "https://example.org/training/tr-008",
      "language": "es",
      "specializations": ["administration"],
      "coveredSkills": [
        { "skillId": "PA-OFF-0001", "level": 2 },
        { "skillId": "PA-OFF-0003", "level": 2 }
      ],
      "prerequisites": [],
      "costUsd": 45,
      "durationHours": 50,
      "modality": "onsite",
      "location": { "lat": 8.99, "lng": -79.51 },
      "schedule": { "days": [1, 2, 3], "startMinute": 510, "endMinute": 660, "weeklyHours": 7.5 },
      "seatsAvailable": 18,
      "credentialRelevance": 0.4,
      "source": "catalogo-panama",
      "retrievedAt": "2026-10-31T06:00:00.000Z"
    },
    {
      "opportunityId": "TR-009",
      "title": "Atención al cliente de excelencia",
      "provider": "Edutin",
      "type": "course",
      "url": "https://example.org/training/tr-009",
      "language": "es",
      "specializations": ["customer_service"],
      "coveredSkills": [
        { "skillId": "PA-CS-0001", "level": 2 },
        { "skillId": "PA-SOFT-0002", "level": 2 }
      ],
      "prerequisites": [],
      "costUsd": 0,
      "durationHours": 18,
      "modality": "online",
      "location": null,
      "schedule": null,
      "seatsAvailable": 100,
      "credentialRelevance": 0.3,
      "source": "catalogo-panama",
      "retrievedAt": "2026-10-31T06:00:00.000Z"
    },
    {
      "opportunityId": "TR-010",
      "title": "Certificación en servicio al cliente",
      "provider": "Coursera",
      "type": "certification",
      "url": "https://example.org/training/tr-010",
      "language": "es",
      "specializations": ["customer_service"],
      "coveredSkills": [{ "skillId": "PA-CS-0001", "level": 3 }],
      "prerequisites": [],
      "costUsd": 49,
      "durationHours": 40,
      "modality": "online",
      "location": null,
      "schedule": null,
      "seatsAvailable": 30,
      "credentialRelevance": 0.8,
      "source": "catalogo-panama",
      "retrievedAt": "2026-10-31T06:00:00.000Z"
    },
    {
      "opportunityId": "TR-011",
      "title": "Manejo de caja y arqueo",
      "provider": "INFOTEC",
      "type": "course",
      "url": "https://example.org/training/tr-011",
      "language": "es",
      "specializations": ["customer_service"],
      "coveredSkills": [{ "skillId": "PA-CS-0002", "level": 2 }],
      "prerequisites": [],
      "costUsd": 60,
      "durationHours": 30,
      "modality": "onsite",
      "location": { "lat": 8.97, "lng": -79.53 },
      "schedule": { "days": [2, 4], "startMinute": 1080, "endMinute": 1260, "weeklyHours": 6 },
      "seatsAvailable": 16,
      "credentialRelevance": 0.5,
      "source": "catalogo-panama",
      "retrievedAt": "2026-10-15T00:00:00.000Z"
    },
    {
      "opportunityId": "TR-012",
      "title": "Ventas y cierre",
      "provider": "Udemy",
      "type": "course",
      "url": "https://example.org/training/tr-012",
      "language": "es",
      "specializations": ["customer_service"],
      "coveredSkills": [{ "skillId": "PA-CS-0003", "level": 2 }],
      "prerequisites": [],
      "costUsd": 20,
      "durationHours": 22,
      "modality": "online",
      "location": null,
      "schedule": null,
      "seatsAvailable": 70,
      "credentialRelevance": 0.4,
      "source": "catalogo-panama",
      "retrievedAt": "2026-10-31T06:00:00.000Z"
    },
    {
      "opportunityId": "TR-013",
      "title": "CRM para principiantes",
      "provider": "Coursera",
      "type": "course",
      "url": "https://example.org/training/tr-013",
      "language": "es",
      "specializations": ["customer_service", "administration"],
      "coveredSkills": [{ "skillId": "PA-CS-0004", "level": 2 }],
      "prerequisites": [],
      "costUsd": 39,
      "durationHours": 28,
      "modality": "online",
      "location": null,
      "schedule": null,
      "seatsAvailable": 40,
      "credentialRelevance": 0.6,
      "source": "catalogo-panama",
      "retrievedAt": "2026-10-31T06:00:00.000Z"
    },
    {
      "opportunityId": "TR-014",
      "title": "Telemercadeo efectivo",
      "provider": "Edutin",
      "type": "course",
      "url": "https://example.org/training/tr-014",
      "language": "es",
      "specializations": ["customer_service"],
      "coveredSkills": [{ "skillId": "PA-CS-0005", "level": 2 }],
      "prerequisites": [],
      "costUsd": 0,
      "durationHours": 16,
      "modality": "online",
      "location": null,
      "schedule": null,
      "seatsAvailable": 90,
      "credentialRelevance": 0.25,
      "source": "catalogo-panama",
      "retrievedAt": "2026-10-31T06:00:00.000Z"
    },
    {
      "opportunityId": "TR-015",
      "title": "Control de inventario",
      "provider": "Edutin",
      "type": "course",
      "url": "https://example.org/training/tr-015",
      "language": "es",
      "specializations": ["administration", "customer_service"],
      "coveredSkills": [{ "skillId": "PA-CS-0006", "level": 2 }],
      "prerequisites": [],